{
  "schema_version": 1,
  "project_identity": "sha256:0000000000000000000000000000000000000000000000000000000000000000",
  "epic_id": "epic-2026-09-a",
  "artifact_class": "tech_plan",
  "destination": "03-technical-plan.md",
  "expected_previous": {
    "state": "file",
    "sha256": "aaaaaaaaaaaaaaaaaaaaaaaaaaaaaaaaaaaaaaaaaaaaaaaaaaaaaaaaaaaaaaaa",
    "mode": 420
  },
  "intended_sha256": "bbbbbbbbbbbbbbbbbbbbbbbbbbbbbbbbbbbbbbbbbbbbbbbbbbbbbbbbbbbbbbbb",
  "intended_size": 4096,
  "observed_sha256": "bbbbbbbbbbbbbbbbbbbbbbbbbbbbbbbbbbbbbbbbbbbbbbbbbbbbbbbbbbbbbbbb",
  "observed_size": 4096,
  "observed_mode": 420,
  "operation_id": "op-7f2c",
  "planning_base_oid": "cccccccccccccccccccccccccccccccccccccccc",
  "pathspec_digest": "dddddddddddddddddddddddddddddddddddddddddddddddddddddddddddddddd",
  "runtime_identity": {
    "workflow": "feature-dev",
    "digest": "eeeeeeeeeeeeeeeeeeeeeeeeeeeeeeeeeeeeeeeeeeeeeeeeeeeeeeeeeeeeeeee",
    "graph": "ffffffffffffffffffffffffffffffffffffffffffffffffffffffffffffffff",
    "helper": "1111111111111111111111111111111111111111111111111111111111111111"
  },
  "policy": {
    "max_bytes": 16777216,
    "allowed_modes": [
      420,
      436
    ]
  },
  "phase": "verified",
  "quarantine": {
    "state": "none"
  },
  "reconciliation": {
    "state": "agreed"
  },
  "recorded_at": "2026-09-08T12:00:00.000Z",
  "sequence": 1
}
